### ISSUE TITLE
Precondition Failed

### ISSUE THREAD

**Issue by evakq8r** [sockless-coding/panasonic_cc#331]
### Checklist

- [X] I have verified that the account and device works in the Comfort Cloud App.
- [X] This issue only contains 1 issue (if you have multiple issues, open one issue for each issue).
- [X] This issue is not a duplicate issue of currently [previous issues](https://github.com/sockless-coding/panasonic_cc/issues?q=is%3Aissue+label%3A"bug"+)..

### What version of Home Assistant Core?

core-2024.10.4

### Describe the issue

Aircon dashboard went unavailable ~30 minutes ago. Reviewed logs, found 'Precondition failed'. Logging into the Panasonic App works without issue and the Aircon can still be controlled via the app, just not HA.

![image](https://github.com/user-attachments/assets/1aea9913-ce0a-41e3-ad09-b872f663437e)

![image](https://github.com/user-attachments/assets/d83d3041-c466-4c3f-a323-cffdc8709f7f)

### Error/Debug Logs

```text
Logger: custom_components.panasonic_cc.coordinator
Source: custom_components/panasonic_cc/coordinator.py:86
integration: Panasonic Comfort Cloud (documentation, issues)
First occurred: 11:37:36 (56 occurrences)
Last logged: 12:05:05

Error fetching device data from API: (get_status: Expected status code 200, received: 412: { "code":41201, "message":"Precondition Failed" }
Traceback (most recent call last):
  File "/config/custom_components/panasonic_cc/coordinator.py", line 86, in _fetch_device_data
    if await self._api_client.try_update_device(self._device):
       ^^^^^^^^^^^^^^^^^^^^^^^^^^^^^^^^^^^^^^^^^^^^^^^^^^^^^^
  File "/config/custom_components/panasonic_cc/pcomfortcloud/apiclient.py", line 178, in try_update_device
    json_response = await self._get_device_status(device.info)
                    ^^^^^^^^^^^^^^^^^^^^^^^^^^^^^^^^^^^^^^^^^^
  File "/config/custom_components/panasonic_cc/pcomfortcloud/apiclient.py", line 169, in _get_device_status
    json_response = await self.execute_get(self._get_device_status_now_url(device_info.guid), "get_status", 200)
                    ^^^^^^^^^^^^^^^^^^^^^^^^^^^^^^^^^^^^^^^^^^^^^^^^^^^^^^^^^^^^^^^^^^^^^^^^^^^^^^^^^^^^^^^^^^^^
  File "/config/custom_components/panasonic_cc/pcomfortcloud/panasonicsession.py", line 145, in execute_get
    await check_response(response, function_description, expected_status_code)
  File "/config/custom_components/panasonic_cc/pcomfortcloud/helpers.py", line 32, in check_response
    raise exceptions.ResponseError(
custom_components.panasonic_cc.pcomfortcloud.exceptions.ResponseError: (get_status: Expected status code 200, received: 412: {
  "code":41201,
  "message":"Precondition Failed"
}
```

**Comment by Adavidebaba** [comment]
mee to today

**Comment by rtr3983** [comment]
Same issue here.
Appeared around the same time too.

**Comment by rtr3983** [comment]
> I wonder if we'll ever be able to manage everything just on local. ...

That would be lovely

**Comment by larayorch** [comment]
> I wonder if we'll ever be able to manage everything just on local. ...

There IS a way to manage locally only, but it involves building your own WiFi adapter for the AC unit and replacing the original one. There is a guide somewhere, I'll see if I can find the link again.

**Comment by craigwhiteheadnz** [comment]
Same issue, within the last 90 minutes

**Comment by Adavidebaba** [comment]
> > I wonder if we'll ever be able to manage everything just on local. ...
> 
> There IS a way to manage locally only, but it involves building your own WiFi adapter for the AC unit and replacing the original one. There is a guide somewhere, I'll see if I can find the link again.
> 
> UPDATE: Here's the link: https://www.espthings.io/index.php/2023/09/02/esphome-panasonic-climate-interface/

Thank you man!!!

**Comment by notio-ca** [comment]
I am down too, Panasonic app ok but the integration failed to connect to the api.
All entities unavailable.
Thanks for anyone to help!!
Cheers!

**Comment by JinksKid** [comment]
Mine is also down :(

**Comment by djmaxim1981** [comment]
Facing the same issue :(


Logger: homeassistant.config_entries
Source: config_entries.py:594
First occurred: 10:53:10 AM (2 occurrences)
Last logged: 11:12:16 AM

Error setting up entry for panasonic_cc
Traceback (most recent call last):
  File "/config/custom_components/panasonic_cc/pcomfortcloud/apiclient.py", line 64, in start_session
    await self._get_groups()
  File "/config/custom_components/panasonic_cc/pcomfortcloud/apiclient.py", line 79, in _get_groups
    self._groups = await self.execute_get(
                   ^^^^^^^^^^^^^^^^^^^^^^^
  File "/config/custom_components/panasonic_cc/pcomfortcloud/panasonicsession.py", line 145, in execute_get
    await check_response(response, function_description, expected_status_code)
  File "/config/custom_components/panasonic_cc/pcomfortcloud/helpers.py", line 32, in check_response
    raise exceptions.ResponseError(
custom_components.panasonic_cc.pcomfortcloud.exceptions.ResponseError: (get_groups: Expected status code 200, received: 412: {
  "code":41201,
  "message":"Precondition Failed"
}

During handling of the above exception, another exception occurred:

Traceback (most recent call last):
  File "/usr/src/homeassistant/homeassistant/config_entries.py", line 594, in async_setup
    result = await component.async_setup_entry(hass, self)
             ^^^^^^^^^^^^^^^^^^^^^^^^^^^^^^^^^^^^^^^^^^^^^
  File "/config/custom_components/panasonic_cc/__init__.py", line 76, in async_setup_entry
    await api.start_session()
  File "/config/custom_components/panasonic_cc/pcomfortcloud/apiclient.py", line 67, in start_session
    await self.reauthenticate()
  File "/config/custom_components/panasonic_cc/pcomfortcloud/apiclient.py", line 71, in reauthenticate
    await super().reauthenticate()
  File "/config/custom_components/panasonic_cc/pcomfortcloud/panasonicsession.py", line 68, in reauthenticate
    await self._authentication.authenticate(self._username, self._password)
  File "/config/custom_components/panasonic_cc/pcomfortcloud/panasonicauthentication.py", line 68, in authenticate
    await self._retrieve_client_acc()
  File "/config/custom_components/panasonic_cc/pcomfortcloud/panasonicauthentication.py", line 263, in _retrieve_client_acc
    await check_response(response, 'get_acc_client_id', 200)
  File "/config/custom_components/panasonic_cc/pcomfortcloud/helpers.py", line 32, in check_response
    raise exceptions.ResponseError(
custom_components.panasonic_cc.pcomfortcloud.exceptions.ResponseError: (get_acc_client_id: Expected status code 200, received: 412: {
  "code":41201,
  "message":**"Precondition Failed"**
}

**Comment by blurizi** [comment]
Same here. Hoping Panasonic won't Block and it's just temporary issue..

**Comment by Garagoos** [comment]
Same here :(

**Comment by Maarc** [comment]
Same issue here as well ...

**Comment by aceindy** [comment]
And here too...

**Comment by Herbi-1966** [comment]
+1

**Comment by adamk125** [comment]
Broken here too. Deleted the integration and tried re-adding, same issue.

**Comment by drseltsamford** [comment]
Same issue here!

**Comment by BenLeitch4654** [comment]
Oh well at lest it's not just me:)

**Comment by CasCas2** [comment]
Same issue here!

**Comment by robertjan** [comment]
same over here :(

**Comment by dannybloe** [comment]
Please don't all reply telling you have the same problem. I guess it is already clear that everybody has this problem.
Thanks.

**Comment by Auka84** [comment]
Same for me :(

**Comment by mizreh** [comment]
Hello,
Seems we have the same problem... 
Same for me since this morning.
Panasonic Comfort Cloud app android working fine. Home assistant get the same error as you all...

**Comment by Moustik2002** [comment]
Same issue here

**Comment by dannybloe** [comment]
Peeps. Please stop replying with 'Same here'!!
Many have notifications turned on but don't want these kind of updates.

**Comment by mkz212** [comment]
Same here. For Homebridge plugin also stop working with same error code.

**Comment by lawrencedudley** [comment]
If anyone from Panasonic is reading this, please stop it. It makes me never want to buy any Panasonic stuff ever again.

**Comment by pacholoamit** [comment]
I'm also having the same issue here. Happened 8 hours ago

```
Logger: homeassistant.config_entries
Source: config_entries.py:594
First occurred: 5:26:00 PM (3 occurrences)
Last logged: 5:55:20 PM

Error setting up entry for panasonic_cc
Traceback (most recent call last):
  File "/config/custom_components/panasonic_cc/pcomfortcloud/apiclient.py", line 64, in start_session
    await self._get_groups()
  File "/config/custom_components/panasonic_cc/pcomfortcloud/apiclient.py", line 79, in _get_groups
    self._groups = await self.execute_get(
                   ^^^^^^^^^^^^^^^^^^^^^^^
  File "/config/custom_components/panasonic_cc/pcomfortcloud/panasonicsession.py", line 145, in execute_get
    await check_response(response, function_description, expected_status_code)
  File "/config/custom_components/panasonic_cc/pcomfortcloud/helpers.py", line 32, in check_response
    raise exceptions.ResponseError(
custom_components.panasonic_cc.pcomfortcloud.exceptions.ResponseError: (get_groups: Expected status code 200, received: 412: {
  "code":41201,
  "message":"Precondition Failed"
}

During handling of the above exception, another exception occurred:

Traceback (most recent call last):
  File "/usr/src/homeassistant/homeassistant/config_entries.py", line 594, in async_setup
    result = await component.async_setup_entry(hass, self)
             ^^^^^^^^^^^^^^^^^^^^^^^^^^^^^^^^^^^^^^^^^^^^^
  File "/config/custom_components/panasonic_cc/__init__.py", line 76, in async_setup_entry
    await api.start_session()
  File "/config/custom_components/panasonic_cc/pcomfortcloud/apiclient.py", line 67, in start_session
    await self.reauthenticate()
  File "/config/custom_components/panasonic_cc/pcomfortcloud/apiclient.py", line 71, in reauthenticate
    await super().reauthenticate()
  File "/config/custom_components/panasonic_cc/pcomfortcloud/panasonicsession.py", line 68, in reauthenticate
    await self._authentication.authenticate(self._username, self._password)
  File "/config/custom_components/panasonic_cc/pcomfortcloud/panasonicauthentication.py", line 68, in authenticate
    await self._retrieve_client_acc()
  File "/config/custom_components/panasonic_cc/pcomfortcloud/panasonicauthentication.py", line 263, in _retrieve_client_acc
    await check_response(response, 'get_acc_client_id', 200)
  File "/config/custom_components/panasonic_cc/pcomfortcloud/helpers.py", line 32, in check_response
    raise exceptions.ResponseError(
custom_components.panasonic_cc.pcomfortcloud.exceptions.ResponseError: (get_acc_client_id: Expected status code 200, received: 412: {
  "code":41201,
  "message":"Precondition Failed"
}
```

**Comment by Olifant1990** [comment]
> I have same issue on Node Red. Panasonic comfort cloud is not accepting login. It tells on response "New version app is published". Something is changed on Panasonic side. This all started during the night.

That's a whole other problem.
Possibly your x-app-version header is not updated.

**Comment by Sakarikarinpoika** [comment]
> > > I wonder if we'll ever be able to manage everything just on local. ...
> > 
> > 
> > There IS a way to manage locally only, but it involves building your own WiFi adapter for the AC unit and replacing the original one. There is a guide somewhere, I'll see if I can find the link again.
> > UPDATE: Here's the link: https://www.espthings.io/index.php/2023/09/02/esphome-panasonic-climate-interface/
> 
> Thank you man!!!

This is way too complicated, at least for me. Unfortunately.  I wonder if it would be possible to use ESP as a substitute for the "Panasonic Cloud" and control AC unit that way?

**Comment by MatthK** [comment]
Login still doesn't work here. Just updated to the latest new version, but can't log in. I still have the Unexpected error creating device.

**Comment by Lavagnou** [comment]
Same issue here

**Comment by maarten-emilsen** [comment]
> > I wonder if we'll ever be able to manage everything just on local. ...
> 
far beyond what I can do.

**Comment by maarten-emilsen** [comment]
me too

**Comment by bdog720** [comment]
> > > > I wonder if we'll ever be able to manage everything just on local. ...
> > > 
> > > 
> > > There IS a way to manage locally only, but it involves building your own WiFi adapter for the AC unit and replacing the original one. There is a guide somewhere, I'll see if I can find the link again.
> > > UPDATE: Here's the link: https://www.espthings.io/index.php/2023/09/02/esphome-panasonic-climate-interface/
> > 
> > 
> > Thank you man!!!
> 
> This is way too complicated, at least for me. Unfortunately. I wonder if it would be possible to use ESP as a substitute for the "Panasonic Cloud" and control AC unit that way?

I'm looking around as well to see what other options are out there as I agree this seems to complicated. I came across this one which is esp and looks simpler 

https://github.com/DomiStyle/esphome-panasonic-ac

**Comment by nelsongraca** [comment]
I'll be digging around to check if I can find what changed @sockless-coding any findings so far?

**Comment by sockless-coding** [comment]
@nelsongraca it doesn't look like they have changed anything in the client request code/headers this time. Haven't had time to confirm this since I had some trouble with my request snooping setup.
But initial findings points to server side validation of the `x-cfc-api-key` header, but the generation of that value is handled by the `Java_com_panasonic_cn_securitylib_PSecurity_createSecurityKey` method located in `libsecurity-lib.so`...

**Comment by codyc1515** [comment]
> @nelsongraca it doesn't look like they have changed anything in the client request code/headers this time. Haven't had time to confirm this since I had some trouble with my request snooping setup. But initial findings points to server side validation of the `x-cfc-api-key` header, but the generation of that value is handled by the `Java_com_panasonic_cn_securitylib_PSecurity_createSecurityKey` method located in `libsecurity-lib.so`...

I faced this same issue with the BYD app, as did some others with different car apps. The only solution in that case was to create an add-on which emulated, say, Android and would pass through the values from the integration to the add-on which would run that .so function and return the output back to the integration.

**Comment by sockless-coding** [comment]
@codyc1515 yeah, I have a few integrations that works that way (Add on + MQTT). But I would prefer not to take that route.
The method isn't super complex, running the lib though a tool like BinaryNinja gives a fairly readable code.

**Comment by Olifant1990** [comment]
I send an email to Panasonic today (translated from Dutch to English by Google Translate, so sorry for mistakes):

-----
Dear Panasonic,

For a number of years I have been using 3 Panasonic air conditioners to my satisfaction.
I have an implementation in use via Home Assistant.
The plugin for this is https://github.com/sockless-coding/panasonic_cc
However, as a developer/hobbyist, I realize that this implementation is not official, but there are many home automation users who control their air conditioners in this way.

Since November 5 early in the morning, I/we believe that security has been further tightened and this API connection is no longer possible.
Could you undo this?

It would be better if home automation users could communicate with the WiFi modules of the air conditioner itself, without having to use the cloud.
For example, you can turn this on via the Comford Cloud app and accept a number of conditions, after which you can use the local API.
Or, a public API from the Comford Cloud. For now it would be great if you could restore the (not entirely official) API for the many Home Assistant users who want to automate something.

Thanks in advance

On behalf of many home automation enthusiasts,

<my name>
------

**Comment by Olifant1990** [comment]
@chamsters

I filled in the contact form on https://www.aircon.panasonic.eu/NL_nl/contact/
If I receive a ticketnumer/response, I will share it

**Comment by Olifant1990** [comment]
For anyone who want to mail too: I got a file number: 00365019
aircon_support@eu.panasonic.com

Just put that number in the subject and body somewhere :)

**Comment by marcel-st** [comment]
Same issue here, i've just send the mail as well.

**Comment by lordzeroMS** [comment]
I have also send a message to the german Panasonic support. 

https://www.aircon.panasonic.eu/DE_de/contact/


Sehr geehrtes Panasonic-Team,

seit einigen Jahren nutze ich mit großer Zufriedenheit eine Klimaanlage von Panasonic. Diese habe ich über Home Assistant eingebunden und verwende dazu ein Plugin, das hier verfügbar ist: https://github.com/sockless-coding/panasonic_cc. Als Entwickler und Hobbyist ist mir bewusst, dass diese Implementierung inoffiziell ist. Dennoch nutzen viele Anwender im Bereich Heimautomatisierung diese Möglichkeit, um ihre Klimaanlagen zu steuern.

Seit dem frühen Morgen des 5. November scheint es jedoch, als seien die Sicherheitsmaßnahmen verschärft worden, wodurch diese API-Verbindung nicht mehr funktioniert. Wäre es möglich, diese Änderung rückgängig zu machen?

Langfristig wäre es wünschenswert, wenn Heimautomationsnutzer direkt mit dem WLAN-Modul der Klimaanlage kommunizieren könnten, ohne auf die Cloud angewiesen zu sein. Panasonic könnte hierfür beispielsweise eine Option in der Comfort Cloud-App anbieten, die Benutzer aktivieren können, um nach Annahme bestimmter Bedingungen die lokale API zu nutzen – oder alternativ eine öffentliche API für die Comfort Cloud zur Verfügung stellen. Für den Moment wäre es großartig, wenn die (inoffizielle) API wiederhergestellt werden könnte, da viele Home Assistant-Nutzer auf sie angewiesen sind, um ihre Automatisierungen umzusetzen.

Vielen Dank im Voraus.

Mit freundlichen Grüßen,
...
Im Namen vieler Heimautomatisierungs-Enthusiasten

**Comment by dannybloe** [comment]
Do we really have to post all this here? Can't we just stick to the issue at hand instead of posting all indivual complaints to Panasonic? Perhaps create a new ticktet for this and move that conversation over there.

**Comment by chamsters** [comment]
> Do we really have to post all this here? Can't we just stick to the issue at hand instead of posting all indivual complaints to Panasonic? Perhaps create a new ticktet for this and move that conversation over there.

If this issue is sourced on the Panasonic side and there's little we can do at our end, isn't it best we collaborate a bit to push them to resolution? Or should there be no coordinated effort, no chat against this thread (as there's potentially no technical solution at our end) and we just sit around waiting for magic to happen?

**Comment by paducz** [comment]
> > Do we really have to post all this here? Can't we just stick to the issue at hand instead of posting all indivual complaints to Panasonic? Perhaps create a new ticktet for this and move that conversation over there.
> 
> If this issue is sourced on the Panasonic side and there's little we can do at our end, isn't it best we collaborate a bit to push them to resolution? Or should there be no coordinated effort, no chat against this thread (as there's potentially no technical solution at our end) and we just sit around waiting for magic to happen?

I am afraid their intention is to block everything not coming from the app as much as possible ...they do not want to help us.

**Comment by marcel-st** [comment]
> > > Do we really have to post all this here? Can't we just stick to the issue at hand instead of posting all indivual complaints to Panasonic? Perhaps create a new ticktet for this and move that conversation over there.
> > 
> > 
> > If this issue is sourced on the Panasonic side and there's little we can do at our end, isn't it best we collaborate a bit to push them to resolution? Or should there be no coordinated effort, no chat against this thread (as there's potentially no technical solution at our end) and we just sit around waiting for magic to happen?
> 
> I am afraid their intention is to block everything not coming from the app as much as possible ...they do not want to help us.

but the Google home/Alexa integration does work?

**Comment by chamsters** [comment]
> > > > Do we really have to post all this here? Can't we just stick to the issue at hand instead of posting all indivual complaints to Panasonic? Perhaps create a new ticktet for this and move that conversation over there.
> > > 
> > > 
> > > If this issue is sourced on the Panasonic side and there's little we can do at our end, isn't it best we collaborate a bit to push them to resolution? Or should there be no coordinated effort, no chat against this thread (as there's potentially no technical solution at our end) and we just sit around waiting for magic to happen?
> > 
> > 
> > I am afraid their intention is to block everything not coming from the app as much as possible ...they do not want to help us.
> 
> but the Google home/Alexa integration does work?

That's an official 'integration' - part of their marketing and product capabilities. So they won't block that.

**Comment by MindFreeze** [comment]
They can get "Works with Home Assistant" for their marketing and product capabilities too 😉 . If everyone is writing letters to Panasonic, you could mention this https://partner.home-assistant.io/

**Comment by marcel-st** [comment]
> > > > > Do we really have to post all this here? Can't we just stick to the issue at hand instead of posting all indivual complaints to Panasonic? Perhaps create a new ticktet for this and move that conversation over there.
> > > > 
> > > > 
> > > > If this issue is sourced on the Panasonic side and there's little we can do at our end, isn't it best we collaborate a bit to push them to resolution? Or should there be no coordinated effort, no chat against this thread (as there's potentially no technical solution at our end) and we just sit around waiting for magic to happen?
> > > 
> > > 
> > > I am afraid their intention is to block everything not coming from the app as much as possible ...they do not want to help us.
> > 
> > 
> > but the Google home/Alexa integration does work?
> 
> That's an official 'integration' - part of their marketing and product capabilities. So they won't block that.

isn't there a way to use that integration within HA?

**Comment by d96moe** [comment]
> > > > > I wonder if we'll ever be able to manage everything just on local. ...
> > > > 
> > > > 
> > > > There IS a way to manage locally only, but it involves building your own WiFi adapter for the AC unit and replacing the original one. There is a guide somewhere, I'll see if I can find the link again.
> > > > UPDATE: Here's the link: https://www.espthings.io/index.php/2023/09/02/esphome-panasonic-climate-interface/
> > > 
> > > 
> > > Thank you man!!!
> > 
> > 
> > This is way too complicated, at least for me. Unfortunately. I wonder if it would be possible to use ESP as a substitute for the "Panasonic Cloud" and control AC unit that way?
> 
> I'm looking around as well to see what other options are out there as I agree this seems to complicated. I came across this one which is esp and looks simpler
> 
> https://github.com/DomiStyle/esphome-panasonic-ac

That is the sourcecode used for the HW mentioned in the first link. The first link is details on one way of building the HW needed for the sourcecode:-) I strongly concidering to order the parts and build o couple of them myself. Need to get rid of the comfort cloud dependenciy at home.

**Comment by bdog720** [comment]
> > > > > > I wonder if we'll ever be able to manage everything just on local. ...
> > > > > 
> > > > > 
> > > > > There IS a way to manage locally only, but it involves building your own WiFi adapter for the AC unit and replacing the original one. There is a guide somewhere, I'll see if I can find the link again.
> > > > > UPDATE: Here's the link: https://www.espthings.io/index.php/2023/09/02/esphome-panasonic-climate-interface/
> > > > 
> > > > 
> > > > Thank you man!!!
> > > 
> > > 
> > > This is way too complicated, at least for me. Unfortunately. I wonder if it would be possible to use ESP as a substitute for the "Panasonic Cloud" and control AC unit that way?
> > 
> > 
> > I'm looking around as well to see what other options are out there as I agree this seems to complicated. I came across this one which is esp and looks simpler
> > https://github.com/DomiStyle/esphome-panasonic-ac
> 
> That is the sourcecode used for the HW mentioned in the first link. The first link is details on one way of building the HW needed for the sourcecode:-) I strongly concidering to order the parts and build o couple of them myself. Need to get rid of the comfort cloud dependenciy at home.

Yes this is the source code but it also explains how to build one. If you read some of the discussion people have it working just on an esp32 and nothing else. I've ordered one plus the required connector. I'll test it out when it arrives

**Comment by Cyrelion** [comment]
> Yes this is the source code but it also explains how to build one. If you read some of the discussion people have it working just on an esp32 and nothing else. I've ordered one plus the required connector. I'll test it out when it arrives

I’m still struggling to find the correct connector for my device. Ordered three different that looked that it would fit but doesn’t 😭

Have the esp already here and configured

**Comment by Garagoos** [comment]
Even if it probably won't help much, I have also opened a very detailed support ticket with Panasonic Germany (aircon_support_de@eu.panasonic.com).

Case number: 00365238

I really hope that Panasonic takes action here and doesn't leave all HomeAssitant / IO Broker users in the lurch

Perhaps @sockless-coding can still work magic

**Comment by marcel-st** [comment]
> > > > I wonder if we'll ever be able to manage everything just on local. ...
> > > 
> > > 
> > > There IS a way to manage locally only, but it involves building your own WiFi adapter for the AC unit and replacing the original one. There is a guide somewhere, I'll see if I can find the link again.
> > > UPDATE: Here's the link: https://www.espthings.io/index.php/2023/09/02/esphome-panasonic-climate-interface/
> > 
> > 
> > Thank you man!!!
> 
> This is way too complicated, at least for me. Unfortunately. I wonder if it would be possible to use ESP as a substitute for the "Panasonic Cloud" and control AC unit that way?

PCBWay seems to offer the PCB + Assembly and components.  (https://www.pcbway.com/project/shareproject/espthings_io_ET_P1101_ESPHome_Panasonic_Climate_Interface_4cc10e31.html)

I've requested a quote and the PCB + Assembly is $29 for 2 units, only waiting for the components quote now.

**Comment by thewan056** [comment]
> I've requested a quote and the PCB + Assembly is $29 for 2 units, only waiting for the components quote now.

I would like to discourage you, and others to not support the creator and author of this project. They are discriminating against those who can't do diy even for health or body function reasons, telling anyone who can't diy to abandon the project altogether regardless if the reason is legitimate or not. If this is the only choice, then please do not use their affiliate links as it encourages even more discrimination.

**Comment by TheLordVader** [comment]
Got this answer from Panasonic Swedenm they didn't even comment on the strenghtened security as of nov 5,
"Hi Anders,

Thank you for your email.

Unfortunately, there is no open API or any plan for it to come. Sorry that's not the answer you want but unfortunately it is.

Kind regards
Frederick
Panasonic Support"

**Comment by asatron1** [comment]
@marcel-st 
PCB + Assembly include´s all parts inkl. esp?

**Comment by sgaduuw** [comment]
> > I've requested a quote and the PCB + Assembly is $29 for 2 units, only waiting for the components quote now.
> 
> I would like to discourage you, and others to not support the creator and author of this project. They are discriminating against those who can't do diy even for health or body function reasons, telling anyone who can't diy to abandon the project altogether regardless if the reason is legitimate or not. If this is the only choice, then please do not use their affiliate links as it encourages even more discrimination.

How is this discriminating? There is a knowledge bar and skill bar that needs to be met to even start with such a project. It's simply a warning that it might be smarter to not waste your time

**Comment by mmib** [comment]
> @marcel-st PCB + Assembly include´s all parts inkl. esp?

You only need esp32, logic converter 5v <-> 3.3v and connector. No PCB needed

**Comment by asatron1** [comment]
@mmib 
it must be DNSK-P11 or CZ-TACG1 but on my modul i dont find a model like this..... or can i use this port?

![3](https://github.com/user-attachments/assets/12e258cf-1dbd-4903-8877-477e0b6ffe37)
![2](https://github.com/user-attachments/assets/f8819035-e903-4c0d-9ea3-f92b6e0d672f)

**Comment by freman** [comment]
I got 3 of the boards someone else was advertising last time Panasonic borked us for a while... ya'll got it working again before my order arrived so they've just been sitting in a drawer... I've sent my email to Panasonic but meh, tomorrow I might be swapping out the wifi units.

**Comment by bisand** [comment]
> Got this answer from Panasonic Swedenm they didn't even comment on the strenghtened security as of nov 5, "Hi Anders,
> 
> Thank you for your email.
> 
> Unfortunately, there is no open API or any plan for it to come. Sorry that's not the answer you want but unfortunately it is.
> 
> Kind regards Frederick Panasonic Support"

Let’s remeber this next time we think about buying new Panasonic equipment… There are other, better alternatives! ;)

**Comment by kollarg80** [comment]
> > @marcel-st PCB + Assembly include´s all parts inkl. esp?
> 
> You only need esp32, logic converter 5v <-> 3.3v and connector. No PCB needed

Is that solution working? That has code years old. Anyone using this?

**Comment by pacholoamit** [comment]
I ain't admitting defeat here... ISTG, there is a way forward without having to do any hardware stuff.. Here's what I'm currently doing..

I'm using Charles proxy to proxy the requests from the panasonic comfort cloud app to my macbook. I, am then able to read all of the network requests from the panasonic comfort cloud app. What I'm trying to figure out, if there's any way to use the tokens/codes that come from logging into the panasonic comfort cloud app..

I'm working right now so I may not have time to commit to it. Sensitive information edited out. I'll continue to look into it but I'm currently at work right now so I won't have time until after to write some code to test things out.

![image](https://github.com/user-attachments/assets/343c2f63-22f8-4ed2-9395-362d16f78c83)

**Comment by sockless-coding** [comment]
@pacholoamit are you debugging the IOS app?
When I patch the android to support my mitm cert I get the same error in the app 
```json
{
    "code": 41201,
    "message": "Precondition Failed"
}
```
![image](https://github.com/user-attachments/assets/a582371f-a061-4981-a7b0-12c20d65bc6b)

**Comment by pacholoamit** [comment]
@sockless-coding , I'm using the Panasonic Comfort Cloud app and intercepting the network requests so hopefully I can find what's missing. I'm writing some nodejs code right now to test to see if I can control the AC  from the tokens/codes I get from the different payloads.

I'm Currently keeping a markdown file to keep track of the values. Next I'll dive into your repo to see how you're controlling the panasonic AC in python, trying to create a working PoC right now where I can change anything at all just to test out if this works.

I mainly followed this guide on youtube on intercepting network requests from the app: https://www.youtube.com/watch?v=r7aV39-CKg4

**Comment by sockless-coding** [comment]
@pacholoamit yeah that is for IOS, the certificate check is a bit annoying for the Android version...
The important part is looking at the accsmart.panasonic.com calls, the auth is easy enough to handle and can be viewed in a browser if you go via https://aquarea-smart.panasonic.com/

**Comment by NoLooseEnds** [comment]
Hmm, I set up mitmproxy to try to see, but I get this from the ios app when I run it through the proxy.

How do they detect that?

![image](https://github.com/user-attachments/assets/220dac31-7f05-49a5-8cea-9291ddf44e74)

**Comment by lawrencedudley** [comment]
Usually by doing certificate pinning in the app annoyingly!

**Comment by NoLooseEnds** [comment]
I was able to get the bearer token by logging out and going from the login window to another app.

```
curl --request GET \
  --url https://authglb.digital.panasonic.com/userinfo \
  --header 'Authorization: Bearer <token>
  
{
  "sub": "auth0|<string>",
  "https://digital.panasonic.com": {
    "last_login_provider": "auth0",
    "pdp_user_id": "9b66ba35c3f30034ab0783a679d3b05844bb3ae5e5fb29c14f4ef52860cdb160",
    "provider": "Panasonic ID",
    "social_only": false,
    "user_country": "<COUNTRYCODE>",
    "user_id": "<COUNTRYIDNUMBER>",
    "user_status": "valid"
  }
}
 ```

**Comment by NoLooseEnds** [comment]
I was able to get the bearer token by logging out and going from the login window to another app.

```
curl --request GET \
  --url https://authglb.digital.panasonic.com/userinfo \
  --header 'Authorization: Bearer <token>
  
{
  "sub": "auth0|<string>",
  "https://digital.panasonic.com": {
    "last_login_provider": "auth0",
    "pdp_user_id": "<string>",
    "provider": "Panasonic ID",
    "social_only": false,
    "user_country": "<COUNTRYCODE>",
    "user_id": "<COUNTRYIDNUMBER>",
    "user_status": "valid"
  }
}
 ```

**Comment by sockless-coding** [comment]
Step 1 would be to get a simple request like `https://accsmart.panasonic.com/resource/resourcePath` to work, this one doesn't require authentication
Headers being sent to it are:
|Header|Value|
-|-
x-app-type| 1
x-app-version| 1.22.0
accept| application/json; charset=utf-8
content-type| application/json
user-agent| G-RAC
x-app-name| Comfort Cloud
x-app-timestamp| 2024-11-06 18:59:43
x-cfc-api-key| jy9757acxcfb1eve7nmoigsz8fxqqqvjj5iiu531gvyx99bwdekbutaj889ee4dx9wf
accept-encoding| gzip

Headers are generated like this
```java
    public d0 intercept(@NonNull w.a aVar) {
        String str;
        String q10 = d.q();
        b0 request = aVar.request();
        PSecurity pSecurity = PSecurity.INSTANCE;
        int createSecurityKey = pSecurity.createSecurityKey(this.f18736a, "Comfort Cloud", q10, m.g());
        if (createSecurityKey == 0) {
            str = pSecurity.getSecurityKey();
        } else {
            str = String.valueOf(createSecurityKey);
        }
        b0.a h10 = request.h();
        h10.
		a("X-APP-TYPE", "1").
		a("X-APP-VERSION", "1.22.0").
		a("Accept", "application/json; charset=utf-8").
		a("Content-Type", "application/json").
		a("User-Agent", "G-RAC").
		a("X-APP-NAME", "Comfort Cloud").
		a("X-APP-TIMESTAMP", q10).
		a("X-CFC-API-KEY", str);
        Context context = this.f18736a;
        String i10 = PreferencesUtil.i(context, PreferencesUtil.r(context));
        if (i10 != null) {
            h10.a("X-Client-Id", i10);
        }
        return aVar.proceed(h10.b());
    }
```

The culprit is probably the `x-cfc-api-key`

**Comment by tomt25** [comment]
Hi, I am very impressed of all your work and I believe in you. I am probably little bit too stupid to help out. But I would love to ;)  but agin I can see my limits. 
My solution for now, in the short run to connect it to HA via IR , remote control Interface (I use Sensibo IR,  made for ac but it should be a simpler and cheeper way) . It works grate for me to send instructions to AC. No receiving of any data or sensors of course.  I can run it by using Better Thermostat Integration..... 
Good luck and I will directly go back to this solution if solved. Then I can use my Sensible elsewhere :)

**Comment by NoLooseEnds** [comment]
> The X-CFC-API-KEY is a custom HTTP header utilized by Panasonic's Comfort Cloud API to authenticate and authorize client requests. This header ensures that only authorized applications can interact with the API, enhancing security by verifying the client's identity.
> 
> When making requests to the Comfort Cloud API, clients include the X-CFC-API-KEY header with a specific value that the server recognizes and validates. This mechanism helps prevent unauthorized access and ensures that only approved applications can control Panasonic's smart devices.
> 
> For example, in the python-panasonic-comfort-cloud project, the X-CFC-API-KEY header is set to "Comfort Cloud" in the HTTP requests to the API:
> ```
> POST https://accsmart.panasonic.com/auth/login HTTP/1.1
> X-APP-TYPE: 1
> X-APP-VERSION: 1.20.1
> User-Agent: G-RAC
> X-APP-TIMESTAMP: 1
> X-APP-NAME: Comfort Cloud
> X-CFC-API-KEY: Comfort Cloud
> Accept: application/json; charset=utf-8
> Content-Type: application/json; charset=utf-8
> ```
> This header and others like X-APP-TYPE and X-APP-VERSION form part of the request's metadata, providing the server with the necessary information to process and authenticate the request appropriately.
> 
> It's important to note that the exact value and usage of the X-CFC-API-KEY may vary depending on the specific implementation and version of the Comfort Cloud API. Developers should refer to the official Panasonic Comfort Cloud API documentation or relevant resources for the most accurate and up-to-date information.
>  // GPT-4

So why should it be so hard to get that from the app? If we have the bearer key?

**Comment by codyc1515** [comment]
> So why should it be so hard to get that from the app? If we have the bearer key?
Because for one thing it's not documented, and two it requires external code to generate currently (as opposed to just Python).

**Comment by NoLooseEnds** [comment]
Yes, but it should be sent with the headers, so if we do a man-in-the-middle proxy we should be able to get that? Maybe we can find the pattern if we collect some?

**Comment by codyc1515** [comment]
> Yes, but it should be sent with the headers, so if we do a man-in-the-middle proxy we should be able to get that? Maybe we can find the pattern if we collect some?

As I said before, it's an external function that cannot be called natively from Python and I don't believe that the values are static, so would need to reverse engineer the .so code.

**Comment by hrrrsn** [comment]
It's frustrating to see Panasonic spend their time on locking us out rather than improving the awful Comfort Cloud app.

@pacholoamit - what version of the iOS app are you running? Did you have to patch it to trust your certificate? Mine seems to be doing SSL pinning.

**Comment by sockless-coding** [comment]
The `X-CFC-API-KEY` is based on several values:
The string constant "Comfort Cloud"
The time sent in the `X-APP-TIMESTAMP` header
The key access token or null if not authenticated
These values are manipulated and hashed using SHA512 manipulated some more and turned in to a 67 character long string

**Comment by NoLooseEnds** [comment]
A few months ago there was another project where the API got hardened, and the solution then was this code.  I have no idea, tbh, but throwing out there in case it sparks some idea:

```
def get_api_key():
    # Get the session token
    r = requests.get('https://api.xxx.xxx/api/v1/authorization-sessions')
    api_token = r.json().get('token')

    # Shift the string by one byte
    shifted_bytes = bytearray(api_token.encode('utf-8'))[1:] + bytearray([api_token.encode('utf-8')[0]])
    shifted_string = shifted_bytes.decode('utf-8')

    # Calculate the MD5 hash of the shifted string
    md5_hash = hashlib.md5(shifted_string.encode('utf-8')).hexdigest()

    return md5_hash
```

**Comment by codyc1515** [comment]
> It's frustrating to see Panasonic spend their time on locking us out rather than improving the awful Comfort Cloud app.

I suggested previously to disable the constant polling in this integration which would significantly reduce the load on Panasonic's servers and that was rejected. This was the natural outcome from that.

**Comment by pacholoamit** [comment]
> It's frustrating to see Panasonic spend their time on locking us out rather than improving the awful Comfort Cloud app.
> 
> @pacholoamit - what version of the iOS app are you running? Did you have to patch it to trust your certificate? Mine seems to be doing SSL pinning.

Hello, I was following this youtube tutorial: https://www.youtube.com/watch?v=r7aV39-CKg4

However as @sockless-coding mentioned, if we can't crack the `X-CFC-API-KEY` , we're kinda screwed unfortunately.

**Comment by nelsongraca** [comment]
> However as @sockless-coding mentioned, if we can't crack the `X-CFC-API-KEY` , we're kinda screwed unfortunately.

@pacholoamit if the apps can calculate it so can we it's a matter of time, I'll try to look into the APK if I find the time.

@garmck I'm pretty sure they knew about it, also let's try to stay on topic and focus our efforts on fixing this 🙂

**Comment by mkz212** [comment]
> > I send an email to Panasonic today (translated from Dutch to English by Google Translate, so sorry for mistakes):
> > Dear Panasonic,
> > For a number of years I have been using 3 Panasonic air conditioners to my satisfaction. I have an implementation in use via Home Assistant. The plugin for this is https://github.com/sockless-coding/panasonic_cc However, as a developer/hobbyist, I realize that this implementation is not official, but there are many home automation users who control their air conditioners in this
> 
> So now that they have the link to the github repo - even if this is fixed, they can now see what is being done to overcome the restrictions everytime....awesome.

Do you think they didn't know before? They didn't wonder why so many "apps" connect to their servers every 30 seconds? Normally, the application is used several times a day, so it connects maybe 20-30 times per day? This integration connects 7680 times per day! Some other plugins / integrations had a refresh time of up to every 3 seconds! Why do you think they keep changing APIs?

**Comment by luuquangvu** [comment]
> > > I send an email to Panasonic today (translated from Dutch to English by Google Translate, so sorry for mistakes):
> > > Dear Panasonic,
> > > For a number of years I have been using 3 Panasonic air conditioners to my satisfaction. I have an implementation in use via Home Assistant. The plugin for this is https://github.com/sockless-coding/panasonic_cc However, as a developer/hobbyist, I realize that this implementation is not official, but there are many home automation users who control their air conditioners in this
> > 
> > 
> > So now that they have the link to the github repo - even if this is fixed, they can now see what is being done to overcome the restrictions everytime....awesome.
> 
> Do you think they didn't know before? They didn't wonder why so many "apps" connect to their servers every 30 seconds? Normally, the application is used several times a day, so it connects maybe 20-30 times per day? This integration connects 7680 times per day! Some other plugins / integrations had a refresh time of up to every 3 seconds! Why do you think they keep changing APIs?

Panasonic developers tried their best to block enthusiastic users. Meanwhile, LG released the official integration for Home Assistant. I paid a lot for five air conditioners, but I decided never to buy any Panasonic products again.
I really respect the author and all heroes to create this integration and tried hard to make it work every month.

**Comment by Hypermobile12** [comment]
> > > I send an email to Panasonic today (translated from Dutch to English by Google Translate, so sorry for mistakes):
> > > Dear Panasonic,
> > > For a number of years I have been using 3 Panasonic air conditioners to my satisfaction. I have an implementation in use via Home Assistant. The plugin for this is https://github.com/sockless-coding/panasonic_cc However, as a developer/hobbyist, I realize that this implementation is not official, but there are many home automation users who control their air conditioners in this
> > 
> > 
> > So now that they have the link to the github repo - even if this is fixed, they can now see what is being done to overcome the restrictions everytime....awesome.
> 
> Do you think they didn't know before? They didn't wonder why so many "apps" connect to their servers every 30 seconds? Normally, the application is used several times a day, so it connects maybe 20-30 times per day? This integration connects 7680 times per day! Some other plugins / integrations had a refresh time of up to every 3 seconds! Why do you think they keep changing APIs?

They Could limit the amount of calls.
Then every developer would go for that max amount. and work around that given amount.
The Problem of overloaded server is fixed as well, 
Without pissing off 40% ? of you Comfort Cloud Users.

**Comment by mkz212** [comment]
> > > > I send an email to Panasonic today (translated from Dutch to English by Google Translate, so sorry for mistakes):
> > > > Dear Panasonic,
> > > > For a number of years I have been using 3 Panasonic air conditioners to my satisfaction. I have an implementation in use via Home Assistant. The plugin for this is https://github.com/sockless-coding/panasonic_cc However, as a developer/hobbyist, I realize that this implementation is not official, but there are many home automation users who control their air conditioners in this
> > > 
> > > 
> > > So now that they have the link to the github repo - even if this is fixed, they can now see what is being done to overcome the restrictions everytime....awesome.
> > 
> > 
> > Do you think they didn't know before? They didn't wonder why so many "apps" connect to their servers every 30 seconds? Normally, the application is used several times a day, so it connects maybe 20-30 times per day? This integration connects 7680 times per day! Some other plugins / integrations had a refresh time of up to every 3 seconds! Why do you think they keep changing APIs?
> 
> They Could limit the amount of calls. Then every developer would go for that max amount. and work around that given amount. The Problem of overloaded server is fixed as well, Without pissing off 40% ? of you Comfort Cloud Users.

They could. But they don't want to. They clearly replied that they not planning an official API.

**Comment by chamsters** [comment]
> > > > I send an email to Panasonic today (translated from Dutch to English by Google Translate, so sorry for mistakes):
> > > > Dear Panasonic,
> > > > For a number of years I have been using 3 Panasonic air conditioners to my satisfaction. I have an implementation in use via Home Assistant. The plugin for this is https://github.com/sockless-coding/panasonic_cc However, as a developer/hobbyist, I realize that this implementation is not official, but there are many home automation users who control their air conditioners in this
> > > 
> > > 
> > > So now that they have the link to the github repo - even if this is fixed, they can now see what is being done to overcome the restrictions everytime....awesome.
> > 
> > 
> > Do you think they didn't know before? They didn't wonder why so many "apps" connect to their servers every 30 seconds? Normally, the application is used several times a day, so it connects maybe 20-30 times per day? This integration connects 7680 times per day! Some other plugins / integrations had a refresh time of up to every 3 seconds! Why do you think they keep changing APIs?
> 
> They Could limit the amount of calls. Then every developer would go for that max amount. and work around that given amount. The Problem of overloaded server is fixed as well, Without pissing off 40% ? of you Comfort Cloud Users.

40%?! You vastly over estimate the volume of nerds out there. I'd venture closer to 1%.

**Comment by mkz212** [comment]
> > > > > I send an email to Panasonic today (translated from Dutch to English by Google Translate, so sorry for mistakes):
> > > > > Dear Panasonic,
> > > > > For a number of years I have been using 3 Panasonic air conditioners to my satisfaction. I have an implementation in use via Home Assistant. The plugin for this is https://github.com/sockless-coding/panasonic_cc However, as a developer/hobbyist, I realize that this implementation is not official, but there are many home automation users who control their air conditioners in this
> > > > 
> > > > 
> > > > So now that they have the link to the github repo - even if this is fixed, they can now see what is being done to overcome the restrictions everytime....awesome.
> > > 
> > > 
> > > Do you think they didn't know before? They didn't wonder why so many "apps" connect to their servers every 30 seconds? Normally, the application is used several times a day, so it connects maybe 20-30 times per day? This integration connects 7680 times per day! Some other plugins / integrations had a refresh time of up to every 3 seconds! Why do you think they keep changing APIs?
> > 
> > 
> > They Could limit the amount of calls. Then every developer would go for that max amount. and work around that given amount. The Problem of overloaded server is fixed as well, Without pissing off 40% ? of you Comfort Cloud Users.
> 
> 40%?! You vastly over estimate the volume of nerds out there. I'd venture closer to 1%.

Answer yourself honestly - how many times a day will you open the Comfort Cloud application (assuming that you only use app to control the air conditioning)? 5 times a day? 20 times? Certainly not 7680 per day - this Integration does it so many times. There are plugins that read the state once an hour when the device is turned off and once every 15 minutes when turned on - that is, about 24-35 times a day. This is what you have to start with. Otherwise they will still block API.

**Comment by Wyger-leystra** [comment]
if we would be able to redirect the calls to the panasonic cloud (using a router / DNS redirect for example), do you think it would be possible to create a mock API? This way we could still use HA and the existing hardware. Like a MITM aproach?

**Comment by mmib** [comment]
> if we would be able to redirect the calls to the panasonic cloud (using a router / DNS redirect for example), do you think it would be possible to create a mock API? This way we could still use HA and the existing hardware. Like a MITM aproach?

this has no sense. HA can call panasonic servers directly

**Comment by fursov** [comment]
I think what @mmib meant, is to mimic Panasonic Cloud for the device itself, so a proxy can intercept commands and do not let them leave the house. Not sure how feasible this is and how difficult to implement.

**Comment by sockless-coding** [comment]
The amount of traffic generated by this integration is negligible to Panasonic... even if it makes 7680 requests per day... that times 1350 (HA analytics) thats 10 368 000 requests per day...
How much traffic do you think the heat pump them self generate? If you look at the google play store it has 500k+ downloads... 
This is some package capture from my heat pump calling home:
```
09:17:53.352805 IP 20.210.0.37.443 > 192.168.11.161.55188: tcp 357
09:17:53.355482 IP 192.168.11.161.55188 > 20.210.0.37.443: tcp 0
09:17:53.781406 IP 192.168.11.161.55188 > 20.210.0.37.443: tcp 69
09:17:54.080559 IP 20.210.0.37.443 > 192.168.11.161.55188: tcp 0
09:17:54.083872 IP 192.168.11.161.55188 > 20.210.0.37.443: tcp 575
09:17:54.375578 IP 20.210.0.37.443 > 192.168.11.161.55188: tcp 0
09:18:18.787482 IP 192.168.11.161.55188 > 20.210.0.37.443: tcp 69
09:18:19.081077 IP 20.210.0.37.443 > 192.168.11.161.55188: tcp 0
09:18:19.083206 IP 192.168.11.161.55188 > 20.210.0.37.443: tcp 69
09:18:19.376876 IP 20.210.0.37.443 > 192.168.11.161.55188: tcp 0
09:18:43.790579 IP 192.168.11.161.55188 > 20.210.0.37.443: tcp 69
09:18:44.083034 IP 20.210.0.37.443 > 192.168.11.161.55188: tcp 0
09:18:44.085094 IP 192.168.11.161.55188 > 20.210.0.37.443: tcp 69
09:18:44.382866 IP 20.210.0.37.443 > 192.168.11.161.55188: tcp 0
09:18:49.199102 IP 192.168.11.161.55188 > 20.210.0.37.443: tcp 69
09:18:49.499145 IP 20.210.0.37.443 > 192.168.11.161.55188: tcp 0
09:18:49.501807 IP 192.168.11.161.55188 > 20.210.0.37.443: tcp 453
09:18:49.769761 IP 20.210.0.37.443 > 192.168.11.161.55188: tcp 245
09:18:49.865567 IP 192.168.11.161.55188 > 20.210.0.37.443: tcp 0
```
Say 2 times per minute... 2880 * 500000 = 1 440 000 000 a few magnitudes more than the integration.... and thats excluding all heatpumps controlled by apple users...

**Comment by sockless-coding** [comment]
@Wyger-leystra not possible, they use MTLS from the heat pump so without getting a valid certificate the heatpump wont connect.

**Comment by Olifant1990** [comment]
https://tweakers.net/nieuws/228460/airconditioning-van-panasonic-is-niet-meer-aan-te-sturen-via-home-assistant.html

Got it in the news, hopefully they will answer to Tweakers :)

**Comment by fursov** [comment]
> The amount of traffic generated by this integration is negligible to Panasonic... even if it makes 7680 requests per day... that times 1350 (HA analytics) thats 10 368 000 requests per day... How much traffic do you think the heat pump them self generate? If you look at the google play store it has 500k+ downloads... This is some package capture from my heat pump calling home:
> 
> ```
> 09:17:53.352805 IP 20.210.0.37.443 > 192.168.11.161.55188: tcp 357
> 09:17:53.355482 IP 192.168.11.161.55188 > 20.210.0.37.443: tcp 0
> 09:17:53.781406 IP 192.168.11.161.55188 > 20.210.0.37.443: tcp 69
> 09:17:54.080559 IP 20.210.0.37.443 > 192.168.11.161.55188: tcp 0
> 09:17:54.083872 IP 192.168.11.161.55188 > 20.210.0.37.443: tcp 575
> 09:17:54.375578 IP 20.210.0.37.443 > 192.168.11.161.55188: tcp 0
> 09:18:18.787482 IP 192.168.11.161.55188 > 20.210.0.37.443: tcp 69
> 09:18:19.081077 IP 20.210.0.37.443 > 192.168.11.161.55188: tcp 0
> 09:18:19.083206 IP 192.168.11.161.55188 > 20.210.0.37.443: tcp 69
> 09:18:19.376876 IP 20.210.0.37.443 > 192.168.11.161.55188: tcp 0
> 09:18:43.790579 IP 192.168.11.161.55188 > 20.210.0.37.443: tcp 69
> 09:18:44.083034 IP 20.210.0.37.443 > 192.168.11.161.55188: tcp 0
> 09:18:44.085094 IP 192.168.11.161.55188 > 20.210.0.37.443: tcp 69
> 09:18:44.382866 IP 20.210.0.37.443 > 192.168.11.161.55188: tcp 0
> 09:18:49.199102 IP 192.168.11.161.55188 > 20.210.0.37.443: tcp 69
> 09:18:49.499145 IP 20.210.0.37.443 > 192.168.11.161.55188: tcp 0
> 09:18:49.501807 IP 192.168.11.161.55188 > 20.210.0.37.443: tcp 453
> 09:18:49.769761 IP 20.210.0.37.443 > 192.168.11.161.55188: tcp 245
> 09:18:49.865567 IP 192.168.11.161.55188 > 20.210.0.37.443: tcp 0
> ```
> 
> Say 2 times per minute... 2880 * 500000 = 1 440 000 000 a few magnitudes more than the integration.... and thats excluding all heatpumps controlled by apple users...

Getting to offtopic, I think...
Though I think the concern is not load to server. I think, they more worry about potential effect on target devices if the API is misused. This can be done by mistake of the API user, or intentionally by some intruder into home system and intentionally trying to break your system. Say, you start sending series of turn-on-off commands every 5 seconds. I believe, the device would die quite soon after this.
They worry about warranty in this case.

**Comment by mmib** [comment]
I think it is a good approach to try to get this into news and push Panasonic to open their API to developers or make a native HA integration. Such things work pretty well, especially if their shareholders will be at risk

**Comment by RonnieRocket2** [comment]
I'm not sure if there is a way around the current problem, but could this be a workaround for the moment....

Control it through the integration supported by Alexa but with the HA Thermostat Card not voice? I know some entities won't be possible like power consumption or swing modes but basic control of mode, temperature and power perhaps this is possible? I have no idea if this is a massive undertaking or not?

**Comment by maarten-emilsen** [comment]
My work around is google Home. It does work. Since ZHA is not working I
give up HA and for now move critical device to google.



Maarten

tor. 7. nov. 2024, 12:38 skrev RonnieRocket2 ***@***.***>:

**Comment by kennethhaspeel** [comment]
> 
> Getting to offtopic, I think... Though I think the concern is not load to server. I think, they more worry about potential effect on target devices if the API is misused. This can be done by mistake of the API user, or intentionally by some intruder into home system and intentionally trying to break your system. Say, you start sending series of turn-on-off commands every 5 seconds. I believe, the device would die quite soon after this. They worry about warranty in this case.

That should easily be caught by the api. There is a difference between GET requests, to get the status and POST requests changing settings. A simple block on 10 POST request within a period of time (just random numbers) can easily prevent your scenario.

disclaimer: if Panasonic follows the logic of GET and POST requests

**Comment by sockless-coding** [comment]
I've confirmed that `x-cfc-api-key` is the reason for the 412 and that it is composed of `x-app-name`, `x-app-timestamp` and token from `x-user-authorization-v2` (if authenticated).
The timestamp doesn't seem to be validated and can be reused. So the main thing is to figure out how the token affects the outcome.

**Comment by AnonymousRetard** [comment]
> I've confirmed that `x-cfc-api-key` is the reason for the 412 and that it is composed of `x-app-name`, `x-app-timestamp` and token from `x-user-authorization-v2` (if authenticated). The timestamp doesn't seem to be validated and can be reused. So the main thing is to figure out how the token affects the outcome.

I decided to give it a go to try and reverse engineer libsecurity-lib.so but I don't really have any experience in reverse engineering unfortunately but I do work as an embedded developer and know a little bit of assembly. After some googling and watching a short youtube video I ended up using Ghidra and have been using it for few hours now trying to decipher the createSecurityKey function.

Unfortunately it looks quite large and I have a really hard time following everything that happens but it looks like the first thing it does is to retrieve the first package signature from "[Landroid/content/pm/Signature:". It looks like this object is an array but the first array element is retrieved from it and then it does a SHA512 on that signature and possibly a timestamp, but it doesn't look like it's the x-app-timestamp.

After this I can't quite follow what happens with this SHA512 but there's hundreds of more lines to analyze, probably with some hardcoded "magic numbers" in there.

Much further down there's also a call to a SHA256 function. It also looks like there's a case in the code from some debug build or environment where the function will just return a random string as the security key but I don't think that helps us.

![panasonic_cc_ghidra](https://github.com/user-attachments/assets/49f201bc-c8ca-49ee-a55a-6c4236d8897a)

**Comment by freman** [comment]
I used ghidra and binary ninja to poke around last night, the first thing it seems to do is compare signatures to one of two strings (debug / production)

**Comment by AnonymousRetard** [comment]
> I used ghidra and binary ninja to poke around last night, the first thing it seems to do is compare signatures to one of two strings (debug / release)
> 
> Figured that was an attempt to prevent us from yoinking the module and just using it

Yeah I took one final look at this before bed and I think it's retrieving the APK package signature, running SHA512 on it and it might return some kind of binary representation only because it looks like FUN0011f82c and the loop it's in is used for converting this data to a hexadecimal string representation, which it then compares to two long hardcoded strings debug/release.

Then further down where it's making the real security key we see the exact same pattern but instead of SHA512 it's SHA256 with some data which looks to be based on the actual inputs to the function.

So now we need to figure out exactly how the inputs are massaged before and after the SHA256 call...

**Comment by woppa684** [comment]
So, controlling the ACs and getting info of the temperature etc via Alexa and Google Assistant is still working, right? So, how do they do it? Panasonic has a deal with them I guess? 

Is it possible to control them with HA through any of those two?

**Comment by marc2016** [comment]
In Alexa it's called a skill. I think Panasonic implements it themselves and then provides this skill. I looked at it yesterday and you can also use ioBroker to control the devices via Alexa.

**Comment by kongjudas** [comment]
How do you get it to work in Google Home? The only option I see is Alexa, which isn't even an option in Norway. I see Tibber has also lost their connection with Panasonic after years.

**Comment by woppa684** [comment]
> How do you get it to work in Google Home? The only option I see is Alexa, which isn't even an option in Norway. I see Tibber has also lost their connection with Panasonic after years.

https://www.panasonic.com/global/hvac/products/comfort-cloud/how-to-set-up-comfort-cloud/link-panasonic-comfort-cloud-app-to-google-assistant.html

**Comment by Pierrefogg** [comment]
I migrated to google home/nest this week, because of The Problem discussed here.After a lot of work setting up automations trigged thermostats, i thought i had a working setup.But Panasonic fucked me yet another time - the connection between google and comfort cloud is really bad and goes up and down.Seriously panasonic - FY8 nov. 2024 kl. 10:23 skrev Roel van Bakel ***@***.***>:﻿

How do you get it to work in Google Home? The only option I see is Alexa, which isn't even an option in Norway. I see Tibber has also lost their connection with Panasonic after years.

https://www.panasonic.com/global/hvac/products/comfort-cloud/how-to-set-up-comfort-cloud/link-panasonic-comfort-cloud-app-to-google-assistant.html

**Comment by JakobAaen** [comment]
> I migrated to google home/nest this week, because of The Problem discussed here.After a lot of work setting up automations trigged thermostats, i thought i had a working setup.But Panasonic fucked me yet another time - the connection between google and comfort cloud is really bad and goes up and down.Seriously panasonic - FY8 nov. 2024 kl. 10:23 skrev Roel van Bakel ***@***.***>:﻿ How do you get it to work in Google Home? The only option I see is Alexa, which isn't even an option in Norway. I see Tibber has also lost their connection with Panasonic after years. https://www.panasonic.com/global/hvac/products/comfort-cloud/how-to-set-up-comfort-cloud/link-panasonic-comfort-cloud-app-to-google-assistant.html —Reply to this email directly, view it on GitHub, or unsubscribe.You are receiving this because you are subscribed to this thread.Message ID: ***@***.***>

I send them a mail, as both the google home and google assistant 50% of the time reponds with unavailable. They only send me a question, if I used Home Assistant, and if that was my problem, Which means, they are aware they fked home assistant on purpose (this was the support in Denmark). Haven't heard from them about Google Home yet.

**Comment by Pierrefogg** [comment]
In the google home app - search for panasonic/comfort cloud under works with google in settings Med vänlig hälsningPierre8 nov. 2024 kl. 10:44 skrev JakobAaen ***@***.***>:﻿

I migrated to google home/nest this week, because of The Problem discussed here.After a lot of work setting up automations trigged thermostats, i thought i had a working setup.But Panasonic fucked me yet another time - the connection between google and comfort cloud is really bad and goes up and down.Seriously panasonic - FY8 nov. 2024 kl. 10:23 skrev Roel van Bakel @.>:﻿ How do you get it to work in Google Home? The only option I see is Alexa, which isn't even an option in Norway. I see Tibber has also lost their connection with Panasonic after years. https://www.panasonic.com/global/hvac/products/comfort-cloud/how-to-set-up-comfort-cloud/link-panasonic-comfort-cloud-app-to-google-assistant.html —Reply to this email directly, view it on GitHub, or unsubscribe.You are receiving this because you are subscribed to this thread.Message ID: @.>

I send them a mail, as both the google home and google assistant 50% of the time reponds with unavailable. They only send me a question, if I used Home Assistant, and if that was my problem, Which means, they are aware they fked home assistant on purpose (this was the support in Denmark). Haven't heard from them about Google Home yet.

**Comment by djmaxim1981** [comment]
> In the google home app - search for panasonic/comfort cloud under works with google in settings Med vänlig hälsningPierre8 nov. 2024 kl. 10:44 skrev JakobAaen ***@***.***>:﻿ I migrated to google home/nest this week, because of The Problem discussed here.After a lot of work setting up automations trigged thermostats, i thought i had a working setup.But Panasonic fucked me yet another time - the connection between google and comfort cloud is really bad and goes up and down.Seriously panasonic - FY8 nov. 2024 kl. 10:23 skrev Roel van Bakel @.>:﻿ How do you get it to work in Google Home? The only option I see is Alexa, which isn't even an option in Norway. I see Tibber has also lost their connection with Panasonic after years. https://www.panasonic.com/global/hvac/products/comfort-cloud/how-to-set-up-comfort-cloud/link-panasonic-comfort-cloud-app-to-google-assistant.html —Reply to this email directly, view it on GitHub, or unsubscribe.You are receiving this because you are subscribed to this thread.Message ID: @.> I send them a mail, as both the google home and google assistant 50% of the time reponds with unavailable. They only send me a question, if I used Home Assistant, and if that was my problem, Which means, they are aware they fked home assistant on purpose (this was the support in Denmark). Haven't heard from them about Google Home yet. —Reply to this email directly, view it on GitHub, or unsubscribe.You are receiving this because you are subscribed to this thread.Message ID: ***@***.***>



In the meantime while this is being worked on, I've reverted to use Sensibo Air to control my Panasonic AC. Works fine.

**Comment by allouchem** [comment]
Since this is a complicated one, I guess few people trying to find temp backups. Some have already mentioned sensibo; however if have a Broadlink IR blaster or similar - then use SmartIR integration with Device Code 1022. Does not allow to control the swing, but a few hours of elbow grease can fix that if needed. I am using an old RM Mini which is about 20 bucks. 

![image](https://github.com/user-attachments/assets/1d46c085-d6dc-4a1b-b353-db8e1c0a2bb5)

**Comment by sockless-coding** [comment]
Version 2024.11.0 has been released

**Comment by adamk125** [comment]
> Version 2024.11.0 has been released

Tried re-adding the integration (deleted it when troubleshooting) and still get this error:

![image](https://github.com/user-attachments/assets/2de155e5-a6ed-45ac-b300-9c3a1365104b)

**Comment by chamsters** [comment]
My only need is energy monitoring...

**Comment by nhdson** [comment]
Thanks to all for getting this up and running again - amazing work.  All working well here with a restart after updating

**Comment by adamk125** [comment]
Looks like its working. Thanks team :)

**Comment by evakq8r** [comment]
Yep, all working here also. Thanks very much!

**Comment by djmaxim1981** [comment]
> Version 2024.11.0 has been released

Nailed it again! Thank you for all that you guys do despite all the complaints!
Its working perfectly now.

**Comment by slavlad** [comment]
Looks like its working. Thanks team :)

**Comment by freman** [comment]
Danke, I guess I won't be pulling apart aircons this weekend, thats great cos I have Christmas props to manufacture

**Comment by marcel-st** [comment]
Awesome work. I'll keep the ordered hardware on the shelf because i expect Panasonic isn't done messing about with their API.

**Comment by Auka84** [comment]
> @sockless-coding Great Work
> 
> pls send a paypal adress . i cant buy coffee thx

good idea, he deserves it :).

**Comment by Herbi-1966** [comment]
> Version 2024.11.0 has been released

Wow, incredible !!😃
I followed the topic and almost gave up hope. But: you did it again! Great achievement!
Thank you so much! 

Regards
Herbi

**Comment by arkasz-dev** [comment]
> @sockless-coding Great Work
> 
> pls send a paypal adress . i cant buy coffee thx
@Garagoos, @Auka84 
I will definitely send a coffee tip, too. I found the tipping link on home assistant forums (see end of his first post): 
https://community.home-assistant.io/t/panasonic-comfort-cloud/229090

or just wait till he is online and confirms the link :)

**Comment by MatthK** [comment]
Awesome job. You're such a lifesaver. Thank you very much.

I ordered the hardware solution on pcbway.com. When that arrives, I can hopefully get rid of the cloud solution and access the A/Cs finally direct.

**Comment by willie013** [comment]
> Awesome job. You're such a lifesaver. Thank you very much.
> 
> I ordered the hardware solution on pcbway.com. When that arrives, I can hopefully get rid of the cloud solution and access the A/Cs finally direct.

I am also opting for the local control route, however, the fix is still much appriated! I genuinely think this is not Panasonic's last attempt to keep us out of the API..

But why do people still order the pcbway.com components? The only thing you need is an ESP32 and a connector with jumper wires to control the AC locally? https://github.com/DomiStyle/esphome-panasonic-ac/issues/111#issue-2118880716

**Comment by lawrencedudley** [comment]
@willie013 I think that wants to have a level shifter on it, 5v GPIO will make the ESP go bang. I am going to pop one together as I do have some level shifters sat here but a nice PCB is prettier.

**Comment by willie013** [comment]
> @willie013 I think that wants to have a level shifter on it, 5v GPIO will make the ESP go bang. I am going to pop one together as I do have some level shifters sat here but a nice PCB is prettier.

No, most esp32 board are 5v tolerant, so that's why I don't see any benefit in the dedicated pcb..

**Comment by lawrencedudley** [comment]
Fair enough! I'll probably use one anyway as it's best-practice. Fun little project for this afternoon.

**Comment by kollarg80** [comment]
> > Awesome job. You're such a lifesaver. Thank you very much.
> > I ordered the hardware solution on pcbway.com. When that arrives, I can hopefully get rid of the cloud solution and access the A/Cs finally direct.
> 
> I am also opting for the local control route, however, the fix is still much appriated! I genuinely think this is not Panasonic's last attempt to keep us out of the API..
> 
> But why do people still order the pcbway.com components? The only thing you need is an ESP32 and a connector with jumper wires to control the AC locally? [DomiStyle/esphome-panasonic-ac#111 (comment)](https://github.com/DomiStyle/esphome-panasonic-ac/issues/111#issue-2118880716)

Actually is it working? I have the 3.3 to 5v level shifter and couple of esp-s, but that repo has at least 3 year old code.

**Comment by kennethhaspeel** [comment]
> > > Awesome job. You're such a lifesaver. Thank you very much.
> > > I ordered the hardware solution on pcbway.com. When that arrives, I can hopefully get rid of the cloud solution and access the A/Cs finally direct.
> > 
> > 
> > I am also opting for the local control route, however, the fix is still much appriated! I genuinely think this is not Panasonic's last attempt to keep us out of the API..
> > But why do people still order the pcbway.com components? The only thing you need is an ESP32 and a connector with jumper wires to control the AC locally? [DomiStyle/esphome-panasonic-ac#111 (comment)](https://github.com/DomiStyle/esphome-panasonic-ac/issues/111#issue-2118880716)
> 
> Actually is it working? I have the 3.3 to 5v level shifter and couple of esp-s, but that repo has at least 3 year old code.

You don't even need the level shifter. The esp works on 5V, as you can read in the link. But if you have the hardware, why not use it. There is nothing wrong with a repo with 3 year old code if nothing has changed. And AC commands don't really change.
I have some esp's lying around for months for this but this add-on did the job. I looked for the boards yesterday but since the add-on works again, the urgency has dropped again. Seems like the esp's are going to continue to collect dust for now ;-)

**Comment by 3003M** [comment]
AWESOME!! Thank you very much @sockless-coding!!!
And FU Panasonic!

**Comment by mkz212** [comment]
Thank you!! 🚀

**Comment by Auka84** [comment]
@sockless-coding  received many coffees today :D. Thx a lot again :)

**Comment by Peter-Versluis** [comment]
Thank you very much for the fix, much appreciated.

**Comment by jaknil0** [comment]
Wow, many thanks to those contributing to fixing this one!!

**Comment by tomt25** [comment]
Same. You guys rock. Actually I have Swedish Tibber and they have also
trouble to get it to work with Panasonic and they have tried in month. I
have complained both to them and Panasonic. You solved this in some hours.
You could sell this solution to them….
Hope you feel grate you earned it :)

fre 8 nov. 2024 kl. 18:03 skrev jaknil0 ***@***.***>:

**Comment by david-collett** [comment]
> I wonder if we'll ever be able to manage everything just on local. ...

If your controller also has Bluetooth, you may be interested in this integration: 
https://github.com/david-collett/panasonic_hc

**Comment by MatthK** [comment]
> @MatthK can you share the order with me? They couldn't source the ESP variant when I tried to order the same.

At first the order got stuck under review. They claimed they can't source the ESP and thus not solder it, and I also had to choose the optional temperature sensor.

I told them I'd be fine without the ESP (having the illusion I might find a way to get them myself, and solder them somehow). But in the confirmed order, they suddenly did list the ESP as well. It's in production now, so I'm cautiously optimistic to get them.

How to load the necessary code and get them working will be another task, but I'll cross that bridge when I get there.

Here is the BOM of my order.
[espthings.io - ET-P1101 ESPHome Panasonic Climate Interface_BOM_PCBWay(3).xlsx](https://github.com/user-attachments/files/17685251/espthings.io.-.ET-P1101.ESPHome.Panasonic.Climate.Interface_BOM_PCBWay.3.xlsx)

**Comment by david-collett** [comment]
> I wonder if we'll ever be able to manage everything just on local. ...

If your controller also has Bluetooth, you may be interested in this integration: 
https://github.com/david-collett/panasonic_hc

**Comment by jack3308** [comment]
> > @MatthK can you share the order with me? They couldn't source the ESP variant when I tried to order the same.
> 
> At first the order got stuck under review. They claimed they can't source the ESP and thus not solder it, and I also had to choose the optional temperature sensor.
> 
> I told them I'd be fine without the ESP (having the illusion I might find a way to get them myself, and solder them somehow). But in the confirmed order, they suddenly did list the ESP as well. It's in production now, so I'm cautiously optimistic to get them.
> 
> How to load the necessary code and get them working will be another task, but I'll cross that bridge when I get there.
> 
> Here is the BOM of my order.
> [espthings.io - ET-P1101 ESPHome Panasonic Climate Interface_BOM_PCBWay(3).xlsx](https://github.com/user-attachments/files/17685251/espthings.io.-.ET-P1101.ESPHome.Panasonic.Climate.Interface_BOM_PCBWay.3.xlsx)
> 

Just so you're aware, I did a similar thing  6 months ago (didn't end up getting it to work right but also couldn't be bothered once this started working again) and the screwed up the order of the wires on the connector. Just double check they got the direction of the connector right for you cause I had to snip all the wires and re do them.
